{
  "schemaVersion": 1,
  "name": "AppDevContainer",
  "remoteUser": "vscode",
  "toolchains": {
    "node": { "version": "22" },
    "java": { "version": "17" },
    "pnpm": { "npmrcPath": "./example.npmrc" }
  },
  "mountDirectories": [
    { "hostPath": "data", "containerPath": "/workspace/data", "readonly": true }
  ],
  "blockedRegistryHostsFile": "examples/blockedRegistryHosts.txt",
  "extraHosts": {
    "test.ipresenttoyou.com": "host-gateway"
  },
  "javaProjectSourcePaths": ["external/ml-genai-demo-v2/src"],
  "customizations": {
    "vscode": {
      "extensions": ["vscjava.vscode-java-pack", "angular.ng-template", "esbenp.prettier-vscode", "saoudrizwan.claude-dev"]
    }
  }
}
